;;;ООПТ регионального значения ;;;;;;;
Березовский;Природный  заказник;Берёзовский район;Орнитофауна: орлан белохвост, краснозобая казарка (на пролете), стерх (на пролете).;Департамент недропользования и природных ресурсов ХМАО-Югры. Бюджетное учреждение ХМАО-Югры «Объединенная дирекция особо охраняемых природных территорий»;43320;Непроизводственный;ООПТ с традиционным природопользованием;https://i.postimg.cc/PJVhYFS3/image.jpg ;;
;;;Млекопитающие: лось, заяц, горностай, барсук, красная лисица, барсук, ондатра.;;;;;;;
Сорумский;Природный  заказник;Белоярский район;Орнитофауна: орлан белохвост, скопа, кобчик, краснозобая казарка (на пролете). ;Департамент недропользования и природных ресурсов ХМАО-Югры. Бюджетное учреждение ХМАО-Югры «Объединенная дирекция особо охраняемых природных территорий»;159300;Производственный;ООПТ с нефтегазовым освоением;https://i.postimg.cc/Px2knRnX/image.jpg ;;
;;;Млекопитающие: лось, бурый медведь, россомаха, лисица красная, заяц-беляк, горностай, соболь, выдра, белка обыкновенная. ;;;;;;;
;;;Сосудистые растения: пальчатокаренник гебридский, кубышка малая, лютик лапландский.;;;;;;;
Унторский;Природный  заказник;Октябрьский район;Орнитофауна: орлан белохвост, кулик – сорока, скопа, сапсан, стерх, краснозобая гагара, гуменник, турпан обыкновенный, пискулька, серый журавль, краснозобая казарка (на пролете).;Департамент недропользования и природных ресурсов ХМАО-Югры. Бюджетное учреждение ХМАО-Югры «Объединенная дирекция особо охраняемых природных территорий»;81526;Непроизводственный;ООПТ с традиционным природопользованием;https://i.postimg.cc/X7Z6tLHW/image.jpg ;;
;;;Млекопитающие: барсук. ;;;;;;;
Сургутский;Природный  заказник;Сургутский район;Орнитофауна: кулик – сорока, скопа, филин, серый гусь, обыкновенный турпан, большой подорлик, серый журавль, осоед обыкновенный, кобчик. ;Департамент недропользования и природных ресурсов ХМАО-Югры. Бюджетное учреждение ХМАО-Югры «Объединенная дирекция особо охраняемых природных территорий»;24530;Производственный;ООПТ с нефтегазовым освоением;https://i.postimg.cc/NjmqjMvP/image.jpg ;;
;;;"Места отела и миграции лося; промысловые пушные звери (соболь, выдра, норка, ондатра, барсук).";;;;;;;
;;;Сосудистые растения: пальчатокаренник гебридский, волчеягодник обыкновенный, тайник сердцевидный и др.;;;;;;;
Система озёр Ун-Новыинклор, Ай-Новыинклор;Памятник природы;Белоярский район;"Уникальный природный комплекс озёр, имеющих экологическое значение, как источника чистой питьевой воды; уникальные водные биоценозы в естественном состоянии - мезотрофные озёра карстового происхождения; прибрежный лесной биоценоз.";Департамент недропользования и природных ресурсов ХМАО-Югры. Бюджетное учреждение ХМАО- Югры «Природный парк «Нумто»;598,4;Непроизводственный;Селитебные;https://i.postimg.cc/0Q5Ln0ML/image.jpg ;;
Луговские мамонты;Памятник природы;Ханты-Мансийский район;Эталонные участки нетронутой природы, редких и особо ценных палеонтологических объектов, стоянки древнего человека палеолитического времени.;Департамент недропользования и природных ресурсов ХМАО-Югры. Бюджетное учреждение ХМАО-Югры «Объединенная дирекция особо охраняемых природных территорий»;161,2;Непроизводственный;Рекреационные;https://i.postimg.cc/Jz1vMQKt/image.jpg ;;
Лешак-Щел ья;Памятник природы;Берёзовский район;Эталонные участки нетронутой природы, редких и особо ценных палеонтологических объектов юрского и нижнемелового периодов, охрана предгорно-увалистого ландшафта.;Департамент недропользования и природных ресурсов ХМАО-Югры. Бюджетное учреждение ХМАО-Югры «Объединенная дирекция особо охраняемых природных территорий»;2320;Непроизводственный;Рекреационные;https://i.postimg.cc/JzrrvZk5/image.jpg ;;
Ильичевски й бор;Памятник природы;Кондинский район;Орнитофауна: орлан белохвост, кулик- сорока.;Департамент недропользования и природных ресурсов ХМАО-Югры. Бюджетное учреждение ХМАО-Югры «Объединенная дирекция особо охраняемых природных территорий»;38;Непроизводственный;ООПТ с лесопромышленным комплексом ;https://i.postimg.cc/rsDWS78z/image.jpg ;;
;;;Млекопитающие: горностай, бурундук, белка, бурозубка, заяц-беляк, бурый медведь, соболь, горностай, ласка, колонок и норка американская. Пути миграции лося. ;;;;;;;
;;;Эталонные участки кедрового массива.;;;;;;;
Остров Овечий;Памятник природы;Нижневартовский район;Млекопитающие: ондатра, заяц-беляк.  ;Департамент недропользования и природных ресурсов ХМАО-Югры. Бюджетное учреждение ХМАО-Югры «Объединенная дирекция особо охраняемых природных территорий»;176;Непроизводственный;Рекреационные;https://i.postimg.cc/3Jp1VDTN/image.jpg ;;
;;;Уникальная природная экосистема расположенная в близи промышленного г. Мегион.;;;;;;;
Остров Смольный;Памятник природы;Нижневартовский район;Орнитофауна: орлан-белохвост, овсянка-дубровник, водно-болотные птицы (чирок-свистунок, шилохвость, свиязь, гоголь, некоторые кулики, сизая чайка);Департамент недропользования и природных ресурсов ХМАО-Югры. Бюджетное учреждение ХМАО-Югры «Объединенная дирекция особо охраняемых природных территорий»;486;Непроизводственный;Рекреационные;https://i.postimg.cc/FzSyMww8/image.jpg ;;
;;;Млекопитающие: бурозубка, ондатра, норка, белка, соболь, лисица.;;;;;;;
;;;Природные экосистемы, имеющие эстетическое и рекреационное значение вблизи промышленного г. Мегион.;;;;;;;
Лесоболотн ая зона Большое Каюково;Памятник природы;Сургутский район;Орнитофауна: орлан белохвост, скопа, сапсан, филин, беркут, краснозобая казарка (на пролете), гуменник.;Департамент недропользования и природных ресурсов ХМАО-Югры. Бюджетное учреждение ХМАО-Югры «Объединенная дирекция особо охраняемых природных территорий»;5753;Производственный;ООПТ с нефтегазовым освоением;https://i.postimg.cc/cLhRGR5x/image.jpg ;;
;;;Млекопитающие: северный олень, лось, соболь, бурый медведь, выдра, норка, росомаха, лисица, песец, белка, волк, рысь, заяц беляк, белка-летяга, колонок, горностай, ласка, ондатра.;;;;;;;
;;;Археологические объекты.;;;;;;;
Чеускински й бор;Памятник природы;Нефтеюганский район;Орнитофауна: сапсан, филин, кречет, краснозобая казарка (на пролете).;Департамент недропользования и природных ресурсов ХМАО-Югры. Бюджетное учреждение ХМАО-Югры «Объединенная дирекция особо охраняемых природных территорий»;100;Непроизводственный;Рекреационные;https://i.postimg.cc/FFS0H5nn/image.jpg ;;
;;;Млекопитающие: барсук. ;;;;;;;
;;;Старейший кедровый бор;;;;;;;
Дальний Нырис;Памятник природы;Нефтеюганский район;;Департамент недропользования и природных ресурсов ХМАО-Югры. Бюджетное учреждение ХМАО-Югры «Объединенная дирекция особо охраняемых природных территорий»;1773,1;Производственный;ООПТ с лесопромышленным комплексом;https://i.postimg.cc/MKbR10w7/image.jpg ;;
;;;Высокопродуктивные эталонные насаждения кедра сибирского;;;;;;;
Реполовский кедровый бор;памятник природы;Ханты-Мансийский район;Орнитофауна: скворец обыкновенный.;Департамент недропользования и природных ресурсов ХМАО-Югры. Бюджетное учреждение ХМАО-Югры «Объединенная дирекция особо охраняемых природных территорий»;161,3;Непроизводственный;Рекреационные;Рисунок в письме;;
;;;Сосудистые растения: гудайера ползучая, гроздовник многораздельный.;;;;;;;
;;;Высокопродуктивные ценные кедровые леса;;;;;;;
ООПТ местного значения;;;;;;;;;;
Озеро Ранге-Тур (ООПТ местного значения);Памятник природы;Советский район;Орнитофауна: орлан белохвост, скопа, сапсан, филин, беркут, гуменник, краснозобая казарка (на пролете), кулик-сорока, серый сорокопут, кречет.;Федеральное государственное бюджетное учреждение «Государственный природный заповедник «Малая Сосьва» имени В.В. Раевского»;863,4;Непроизводственный;Рекреационные;https://i.postimg.cc/cHntCwT8/image.gif ;;
;;;Млекопитающие: лось, соболь, горностай, ласка, заяц-беляк, белка обыкновенная, бурундук, красная и красно-серая полевки, лесной лемминг, бурозубка. ;;;;;;;
;;;Сосудистые растения: прострел желтеющий, гвоздика разноцветная, вероника колосистая, хаммарбия болотная. ;;;;;;;
;;;Историко-культурные и археологические объекты;;;;;;;
